TRE-10000329;04260485210981;10000329;Trendmobil;Scooter Safari von Trendmobil (15 km/h);Mobilität > Elektromobile und Zubehör > Elektromobile;4999.0000;1-2 Wochen;https://www.brandvital.de/scooter-safari-von-trendmobil-15-km-h.html;https://www.brandvital.de/pub/media/catalog/product/s/a/safari_fg_3.3.png;https://www.brandvital.de/pub/media/catalog/product/i/m/img_5808.jpg;;0;0;0;0;0;0;0;0;0;0;0;;<p>Das Elektromobil Safari von Trendmobil ist ein breiter und robuster Scooter mit einer Geschwindigkeit bis ca. 15 km/h. Er ist mit großen Rädern ausgestattet und bietet dadurch viel Sicherheit und Komfort. Zudem verfügt der Scooter Safari über eine 36 Volt Technik, was Ihn besonders leistungsstark macht.</p><br /><p><strong><br /></strong></p><br /><p><strong>Besonderheiten:</strong></p><br /><ul><br /><li>Voll gefedertes Fahrwerk</li><br /><li>Lenkrad und Lenksäule stufenlos verstellbar</li><br /><li>Schnell und einfach erreichbarer "Park-Knopf"</li><br /><li>Leistungsstarker Antrieb mit 36 Volt (3x 55 Ah Batterien)</li><br /><li>Getränkehalter im Fußraum</li><br /><li>LED Beleuchtung vorne und hinten</li><br /><li>2 Rückspiegel</li><br /><li>Korb vorne</li><br /></ul><br /><p> <strong></strong></p><br /><p><strong>Bordcomputer mit:</strong></p><br /><ul><br /><li>Tageskilometer</li><br /><li>Gesamtkilometer</li><br /><li>Geschwindigkeit</li><br /><li>Durchschnittliche Geschwindigkeit und Kilometer</li><br /><li>Temperaturanzeige</li><br /><li>Hohe Akku Kapazität</li><br /></ul>;;
WM-27450;;27450;Löwenstein Medical;Auto-CPAP SOMNObalance mit Atemluftbefeuchter SOMNOaqua;CPAP - Schlafapnoe;1110.0000;3-4 Tage;https://www.brandvital.de/somnobalance-mit-somnoaqua.html;https://www.brandvital.de/pub/media/catalog/product/w/e/weinmann_somnobalance_mit_somnoaqua_2.jpg;;;0;0;0;0;0;0;0;0;0;0;0;;<h3>SOMNObalance+ SOMNOaqua</h3><br /><p><strong>autoCPAP-Gerät mit Ausatemerleichterung softPAP</strong></p><br /><p>HMV-Pos.-Nr.: 14.24.21.0003 – WM 27410 - SOMNObalance<br />HMV-Pos.-Nr.: 14.24.21.1003 – WM 27450 - SOMNObalance mit Atemluftbefeuchter SOMNOaqua</p><br /><p>Das autoCPAP-Therapiegerät SOMNObalance ist ein Komplettgerät bestehend aus einem Grundgerät, einem Warmluftanfeuchter (Somnoaqua), Atemschlauch, Netzteil und einer Netzschlussleitung.</p><br /><p>Mit dem SOMNObalance geniesen den maximalen Therapeikomfort. Es ist extrem leise bei höchster Therapieflexibilität zur Behandlung obstruktiver Schlafapnoe. Die Druckanpassung erfolgt in Phasen, automatisch und auch bedarfsgerecht. Hohe Druckvariabilität und bietet einen Softstart sowohl eine Ein- und Ausschaltautomatik.</p><br /><p><em><strong>Bedienkomfort:</strong></em></p><br /><ul><br /><li>NEU: SD-Speicherkarte für optimierte Arbeitsprozesse:</li><br /><li>einfache Datenübertragung bei Therapie- und Compliance-Kontrolle</li><br /><li>einfache Erstkonfiguration der Geräte</li><br /><li>einfacher Gerätetausch</li><br /><li>Inklusive Therapietagebuch für den Patienten - mit Option zu kostenlosem Download der Applikation „SOMNOjournal für eine attraktive Visualisierung des Therapieverlaufs</li><br /><li>praktische Einstellung der Geräte mithilfe der Masterkarte</li><br /><li>bedienerfreundliches Patienten-Informationsmenü</li><br /><li>umfangreiche statistische Daten übersichtlich dargestellt</li><br /><li>komfortable Ferneinstellung mit SOMNOadjust oder der PC-Software LÖWENSTEINsupport </li><br /></ul><br /><p><em><strong><br /></strong></em></p><br /><p><em><strong>Sicherheit</strong></em></p><br /><ul><br /><li>OPP-Technologie (Obstructive Pressure Peak) zur Unterscheidung zentraler und obstruktiver Apnoen für höchste Therapieeffizienz</li><br /><li>Maskentest für einen komfortablen, sicheren Sitz der Maske</li><br /><li>qualitative Leckageanzeige während der Therapie - zur Sicherstellung der Effektivität</li><br /></ul>;;
WM-24476;;24476;Löwenstein Medical;Bakterienfilter für SOMNObalance;CPAP - Schlafapnoe > CPAP Systeme Zubehör;6.29;3-4 Tage;https://www.brandvital.de/bakterienfilter-fur-somnobalance.html;https://www.brandvital.de/pub/media/catalog/product/f/i/filter.jpg;;;5.9500;5.9500;5.9500;5.9500;5.9500;5.9500;5.9500;5.9500;5.9500;5.9500;5.9500;;Der Bakterienfilter für SOMNObalance dient dem Schutz des Patienten, besonders wenn das Gerät von mehreren Patienten benutzt wird. Entwickelt für Löwenstein medical CPAP-Therapiegeräte, z.B. SOMNOcomfort 2, SOMNOsoft 2 und SOMNObalance.;;
WM-24469;;24469;Löwenstein Medical;DC-Adapter für SOMNObalance;CPAP - Schlafapnoe > CPAP Systeme Zubehör;199;3-4 Tage;https://www.brandvital.de/dc-adapter-fur-somnobalance.html;https://www.brandvital.de/pub/media/catalog/product/d/c/dc-adapter.jpg;;;0;0;0;0;0;0;0;0;0;0;0;;DC-Adapter ermöglicht Ihnen den mobilen Einsatz Ihres SOMNObalance Cpap-Gerätes. ;;
WM-24042;;24042;Löwenstein Medical;SOMNObalance O2 -Zuschaltventil ;CPAP - Schlafapnoe > CPAP Systeme Zubehör;199.99;3-4 Tage;https://www.brandvital.de/somnobalance-o2-zuschaltventil.html;https://www.brandvital.de/pub/media/catalog/product/z/u/zuschaltventil.jpg;;;0;0;0;0;0;0;0;0;0;0;0;;O2 -Zuschaltventil für eine sichere Sauerstoffeinleitung<br /><br />Wo Sauerstoff per zentraler Gasversorgung, Konzentrator, Flasche oder Flüssigtank zugeführt werden soll, kommt das O2 Zuschaltventil von Weinmann ins Spiel. Sollte eine Gerätestörung oder eine anderweitige Störung (z. B. Stromausfall) auftreten, wird die Sauerstoffzufuhr zur Sicherheit sofort gestoppt. So wird die Brandgefahr, die von Sauerstoff ausgeht, minimiert.<br />Das O2 Zuschaltventil ist verwendbar für alle Therapiegeräte mit Ausnahme des Gerätes SOMNOtron. <br /><br />Während der Therapie können bis zu 4 l/min Sauerstoff in die Maske sicher eingeleitet werden. Das Ventil öffnet sich, wenn das Gerät eingeschaltet ist und ordnungsgemäß betrieben wird. <br />;;
ST-190276;04250649122861;190276;Burmeier;Holzverkleidung für Dali Pflegebett;Pflege > Pflegebetten und Zubehör > Bett Zubehör;89;1-2 Wochen;https://www.brandvital.de/holzverkleidung-fur-dali-pflegebett.html;https://www.brandvital.de/pub/media/catalog/product/h/o/holzverkleidung-dali-pflegebett-.jpg;;;0;0;0;0;0;0;0;0;0;0;0;;Holzverkleidung für Dali Pflegebett zur Verkleidung des Fahrgestells. Mit dieser (auch nachträglich montierbaren) Holzfüllung wird das Betten-Fahrgestell einfach verkleidet und wertet Ihr Pflegebett optisch auf, da das Fahrgestell nicht mehr sichtbar ist.;;
ST-51.5024.33;4047037017010;51.5024.33;Burmeier;Pflegebett Burmeier Allura II;Pflege > Pflegebetten und Zubehör > Pflegebetten;1299.0000;1-2 Wochen;https://www.brandvital.de/pflegebett-burmeier-allura-ii.html;https://www.brandvital.de/pub/media/catalog/product/a/l/allura_ii.jpg;;;0;0;0;0;0;0;0;0;0;0;0;;<p>Das Pflegebtt "Allura II" besticht durch Stabilität und Langlebigkeit, sodass es die Heraus­for­de­rungen im Pfle­ge­alltag bestens erfüllt. Die hohe Qualität sichert Ihnen ein robustes und wartungs­armes Pfle­ge­bett, das die Folge­kosten entschei­dend mini­miert.</p><br /><p>Besondere Highlights sind zum einen die niedrige Einstiegshöhe und zum anderen die hohe Arbeitslast von 250kg.  Die Liege­hö­hen­ver­stel­lung ist von 30-80 cm möglich. Der außer­ge­wöhn­lich große Verstell­be­reich von 50 cm sichert ein Höchstmaß an Pfle­ge­kom­fort. Darüber hinaus ist serienmäßig ein 24 Volt Antriebssystem verbaut. Ein Aufrichter ist ebenfalls im Lieferumfang enthalten.</p><br /><ul><br /><li>Handschalter mit Sperrfunktion</li><br /><li>4-geteilte Liegefläche</li><br /><li>Sichere Arbeitslast von 250 kg</li><br /><li>24-Volt-Antriebssystem</li><br /><li>Polyester-Pulverlack versiegelte,Metallteile</li><br /><li>Fußtieflagerung durch Schwenken der Liegefläche einstellbar</li><br /><li>Kopf- und Fußteilfüllungen in Buche-Dekor</li><br /></ul>;;
ST-146602;;146602;Burmeier;Bettaufrichter für Burmeier Lippe IV;Pflege > Pflegebetten und Zubehör > Bett Zubehör;99.0000;1 Woche;https://www.brandvital.de/bettaufrichter-fuer-burmeier-lippe-iv.html;https://www.brandvital.de/pub/media/catalog/product/a/u/aufrichter.jpg;;;0;0;0;0;0;0;0;0;0;0;0;;Der Bett-Aufrichter inklusive eines Triangelgriffes ermöglicht dem Patienten das eigenständige Aufrichten im Bett. Er ist speziell für den Einlegerahmen Burmeier Lippe IV und kann sowohl auf der rechten, als auch auf der linken Bettseite montiert werden. <br /><br />Den passenden Einlegerahmen erhalten Sie ebenfalls bei uns im Shop.;;
HD-814600-;4250386623454;814600;Topro;Leichtgewichtsrollator Topro Troja 2G Premium;Mobilität > Rollatoren und Zubehör > Leichtgewichtsrollatoren;399.0000;3-4 Tage;https://www.brandvital.de/leichtgewichtrollator-troja-2g-topro-p.html;https://www.brandvital.de/pub/media/catalog/product/l/e/leichtgewicht-rollator-topro-troja-2g-premium_sd24.jpg;https://www.brandvital.de/pub/media/catalog/product/t/r/troja_2g_p_silber_s.jpg;https://www.brandvital.de/pub/media/catalog/product/t/r/troja_2g_p_weinrot.jpg;0;0;0;0;0;0;0;0;0;0;0;;<p>Im Gegensatz zum Basic-Rollator verfügt das Premium-Modell serienmäßig über die <strong>Softbereifung</strong> und eine <strong>hochwertige Einkaufstasche</strong> - anstelle eines Einkaufsnetzes. Trotz des Gewichts von nur 7,8 kg ist der TROJA 2G Premium Rollator von Topro bis zu 150 kg belastbar (in der Größe M).</p><br /><p>Der TOPRO Troja 2G ist die konsequente Weiterentwicklung des Rollators TOPRO Troja Classic und bietet viele Verbesserungen gegenüber seinem ausgezeichneten Vorbild:</p><br /><p>Das Aufstehen mit dem Rollator ist durch den von TOPRO entwickelten ERGO Grip viel leichter geworden. Auch bietet er einen neuen Standard für Sitz- und Schiebekomfort wo leichte Stöße abgefedert werden bzw. bequeme und sichere Armauflagen entstanden sind. Für jeden Untergrund die richtige Bereifung und das einfach und ohne großen Aufwand war der Wunsch vieler TOPRO Troja Kunden. Das TOPRO Quick System erlaubt Reifenwechsel in wenigen Sekunden und schon sind Sie auf Kopfsteinpflaster komfortabel und auf glatten Belägen rutschsicher bereift. Neue Taschen, edle Farben und eine breite Auswahl an Zubehör runden die Idee ab.</p><br /><p><strong style="font-size: 1.17em ">Besondere Merkmale:</strong></p><br /><ul><br /><li>Gewicht 7,8 kg</li><br /><li>Belastbarkeit 150 kg</li><br /><li>Einfach faltbar</li><br /><li>Set abnehmbare Komforträder Soft</li><br /><li>Kantenabweiser</li><br /><li>Sitznetz</li><br /><li>TOPRO Ergo Grip - neue ergonomische Greif- und Stützflächen</li><br /><li>abschließbare Tragetasche statt Einkaufsnetz</li><br /><li>Auswechselbare Räder "Topro Quick"</li><br /><li>Höheneinstellung mit Memoryfunktion</li><br /><li>Klingel</li><br /><li>3M Scotchlite Reflektoren</li><br /></ul><br /><p><strong><br /><br /></strong></p><br /><p><strong></strong><br /> <iframe src="https://www.youtube.com/embed/r_dqWvZrC5E" width="560" height="315" frameborder="0"></iframe></p>;;
ST-178986;;178986;Burmeier;Verlängerungskabel für Handschalter Pflegebett;Pflege > Pflegebetten und Zubehör > Bett Zubehör;79.99;1 Woche;https://www.brandvital.de/verlangerungskabel-fur-handschalter-pflegebett.html;https://www.brandvital.de/pub/media/catalog/product/v/e/verl_ngerung_handschalter_burmeier_sd24.jpg;;;0;0;0;0;0;0;0;0;0;0;0;;Verlängerungskabel für Handschalter. Speziell für das Pflegebett Burmeier Lippe IV. Kabellänge 2.40m.<br /><p></p><br /><strong>Bitte beachten Sie, dass der Hersteller in bestimmten Fällen, je nach Grad der Pflegebedürftigkeit, von Verlängerungskabeln aus Sicherheitsgründen abrät.</strong><br />;;
HD-814301 / HD-814306;7054328143010;814300;Topro;Topro Olympos;Mobilität > Rollatoren und Zubehör > Rollatoren;399.0000;1 Woche;https://www.brandvital.de/topro-troja-olympos-s-oder-m.html;https://www.brandvital.de/pub/media/catalog/product/o/l/olympos_s_silber_schraeg_ibs_offroad_mitsh_72dpi_1_1_1_.jpg;https://www.brandvital.de/pub/media/catalog/product/o/l/olympos_s_silber_schraeg_ibs_offroad_mitsh_72dpi_1_1_1_.jpg;;0;0;0;0;0;0;0;0;0;0;0;;<p>Der Rollator Olympos bietet die gewohnte Qualität aus dem Hause Topro und ist besonders für den Gebrauch im Außenbereich geeignet. Er besticht durch sein stabiles und komfortables Fahrverhalten auf Kies- und Waldwegen und unterstütz somit einen aktiven Lebensstil des jeweiligen Nutzers. Besonderes Merkmal ist die Einkaufstasche mit einer Zuladung von bis zu 15 kg, in der sämtliche Einkäufe problemlos verstaut werden können. Weiterer Vorteil des Allroundtalentes ist seine, im Vergleich zu anderen Rollatoren, breitere Sitzfläche. Des weiteren lässt er sich einfach falten und verfügt über eine Memory-Funktion der Griffhöheneinstellung.</p><br /><p> </p><br /><p>Produktübersicht:</p><br /><ul><br /><li>Leichte Handhabung</li><br /><li>einfacher Faltmechnismus</li><br /><li>Memoryfunktion für die eingestellte Griffhöhe</li><br /><li>Verschließbarer Korb mit Zuladung von 15 kg</li><br /><li>Weiche Profilräder für Wlad, Kies und Kopfsteinpflaster</li><br /></ul>;;
AT-8.01.001 ;4028698077186;8.01.001 ;Invacare;Toilettensitzerhöhung Aquatec 90;Toilettensitzerhöhungen;29.9000;3-4 Tage;https://www.brandvital.de/toilettensitzerhohung-aquatec-90.html;https://www.brandvital.de/pub/media/catalog/product/t/s/tse_aquatec_90.jpg;;;5.9500;5.9500;5.9500;5.9500;5.9500;5.9500;5.9500;5.9500;5.9500;5.9500;5.9500;;<p>Die Toilettensitzerhöhung Aquatec 90 ist aus leicht zu reinigendem Material mit glatten Oberflächen. Durch eine einfache und schnelle Fixierung passt sie auf jedes handelsübliche WC-Becken und erhöht dieses um 10 cm. Die Lieferung erfolgt inklusive eines Deckels.</p><br /><ul><br /><li>Leichte Neigung erleichtert Hinsetzen und Aufstehen</li><br /><li>Glatte Oberflächen für bessere Reinigung</li><br /><li>Fixierung am WC-Rand durch Anlegenase und seitliche Clips möglich</li><br /><li>Hohe Belastbarkeit bis zu 225 kg</li><br /><li>Fester Sitz durch Anti-Rutschmatten in den seitlichen Klammern</li><br /></ul>;;
RU-17522000 ;;17521 000;RUSSKA;Toilettensitzerhöhung mit gepolsterten Armlehnen ;Toilettensitzerhöhungen;64.9900;1-2 Wochen;https://www.brandvital.de/toilettensitzerhoher-mit-gepolsterten-armlehnen.html;https://www.brandvital.de/pub/media/catalog/product/t/s/tse_russka.jpg;;;0;0;0;0;0;0;0;0;0;0;0;;<p>Die Toilettensitzerhöhung von Russka erleichtert Patienten mit leichter bis mittlerer Bewegungseinschränkung die Benutzung der eigenen Toilette. Durch die hochschwenkbaren und gepolsterten Griffe bietet sie Ihnen optimalen Halt beim Hinsetzten und Aufstehen. Im Gegensatz zu vielen anderen Toilettensitzerhöhungen, haben Sie hier die Möglichkeit der individuellen Einstellung. Wählen Sie eine der drei Stufen in 6, 10, oder 14 cm Sitzhöhe. Eine einfache Montage garntiert der Schnellspannverschluss auf jedem handelsüblichen WC. </p><br /><ul><br /><li>für alle gängigen WCs</li><br /><li>verstellbare Sitzhöhe</li><br /><li>Fixierung auf WC mittels Schnellspannverschluss</li><br /><li>Belastbarkeit bis zu 120 kg</li><br /></ul><br /><p> </p>;;
RU-17523000;3401077205072;17523000;RUSSKA;Toilettensitzerhöhung Soft;Toilettensitzerhöhungen;78.9900;3-4 Tage;https://www.brandvital.de/toilettensitzerhohung-soft.html;https://www.brandvital.de/pub/media/catalog/product/t/s/tse_trendmobil_typ_10_d_soft.jpg;;;0;0;0;0;0;0;0;0;0;0;0;;<p>Die Toilettensitzerhöhung Soft verfügt über eine besonders angenhem weich gepolsterte Sitzfläche. Sie eignet sich besonders für druckempfindliche Personen. Die Toilettensitzerhöhung erhöht Ihre Sitzfläche um 11 cm und ist daher besonders Gelenkschonend beim Hinsetzen und Aufstehen. Der Toilettensitzerhöher Soft hat eine anatomische Passform und eine Hygienemulde an der Vorderseite. Durch einfaches Aufsetzen auf die Toilette ist er einfach in der Anbringung kann aber auch jederzeit wieder entfernt werden.</p>;;
TRE-11000150;;11000150 ;Trendmobil;Toilettensitzerhöhung TYP TS 10 D ;Toilettensitzerhöhungen;29.9900;Sofort lieferbar;https://www.brandvital.de/toilettensitzerhohung-typ-ts-10-d.html;https://www.brandvital.de/pub/media/catalog/product/t/s/tse_trendmobil_typ_10_d_geschlossen_1.jpg;https://www.brandvital.de/pub/media/catalog/product/t/s/tse_trendmobil_typ_10_d_geschlossen_1.jpg;;5.9500;5.9500;5.9500;5.9500;5.9500;5.9500;5.9500;5.9500;5.9500;5.9500;5.9500;;<p>Toilettensitzerhöhung TYP DS 10 D von Trendmobil ist anatomisch geformt und verfügt über einen Sitz mit Hygieneausschnitt. Darüber hinaus ist sie aus leicht zu reinigendem Kunststoff gefertigt und kann schnell und einfach montiert werden.</p><br /><ul><br /><li>Sitz mit Hygieneausschnitt</li><br /><li>Sitz mit Deckel</li><br /><li>Anatomisch geformt</li><br /><li>Deckel verschraubt</li><br /><li>Schnelle, einfache Montage</li><br /></ul>;;
RU-17524110 ;4048792003164;17524110 ;RUSSKA;Toilettensitzerhöher Clipper;Toilettensitzerhöhungen;39.9900;1 Woche;https://www.brandvital.de/toilettensitzerhoher-clipper.html;https://www.brandvital.de/pub/media/catalog/product/c/l/clipper_russka.jpg;;;5.9500;5.9500;5.9500;5.9500;5.9500;5.9500;5.9500;5.9500;5.9500;5.9500;5.9500;;<p>Der Toilettensitzerhöher Clipper von Russka erhöht den Toilettensitz um ca. 11 cm und wird schnell mit den mitgelieferten Clips am WC befestigt. Er erleichtert bewegungseingeschränkten Personen das Hinsetzten und Aufstehen während des Toilettenganges und entlastet somit die Gelenke.</p><br /><ul><br /><li>passt auf jedes Standard-WC</li><br /><li>Fixierung mittels mitgelieferter Clips am WC</li><br /><li>Erhöhung des Toilettensitzes um ca. 11 cm</li><br /><li>Belastbarkeit bis zu 185 kg </li><br /></ul>;;
DZ-750/14;;750/14;Dietz;Dreh- und Übersetzhilfe für Badewannenlifter ;Dreh- und Transferhilfen;79.99;1 Woche;https://www.brandvital.de/dietz-dreh-und-ubersetzhilfe-fur-badelifter-kanjo.html;https://www.brandvital.de/pub/media/catalog/product/d/r/dreh-und_bersetzhilfe_dietz_sd24.jpg;https://www.brandvital.de/pub/media/catalog/product/d/r/dreh-und-uebersetzhilfe.jpg;;0;0;0;0;0;0;0;0;0;0;0;;Die Drehscheibe besteht aus einer Kunststoffplatte, die mit  weichen Schaumgewebe bezogen ist. <br />Drehscheibe mit Übersetzhilfe ist zusätzlich mit einer Kunststoffschiene ausgestattet. Die Dreh- und Übersetzhilfe in der Farbe <strong>Aquamarine</strong> bietet den Vorteil einer <strong>antibakteriellen Beschichtung</strong>. Beide ermöglichen selbständiges Umsetzen vom Badewannenrand zur Mitte der Sitzfläche. Auch außerhalb des Badebereiches einsetzbar. ;;
DZ-750/31;4250386649614;750/31;Dietz;Badewannenlifter Kanjo Silverline XXL;Badewannenlifter;530;1-2 Wochen;https://www.brandvital.de/badewannenlifter-kanjo-silverline-xxl-von-dietz.html;https://www.brandvital.de/pub/media/catalog/product/k/a/kanjo_xxl_sd.jpg;;;0;0;0;0;0;0;0;0;0;0;0;;<p>Der KANJO Silverline XXL vor Keimen und Erregern durch sein spezielle Oberfläche. Er überzeugt mit angenehmem Sitzkomfort durch ergonomisch geformte Sitz- und Rückenflächen und einstellbarer Liegeposition per Knopfdruck. Hygienischer Badekomfort durch Silber-Ionen-Technik und wasserabweisenden Eigenschaften. Durch die Beschichtung enstehen keine Verfärbungen oder Gerüche und sie ermöglicht eine leichte Reinigung. Die Handsteuerung (groß) ist bei diesem Modell inbegriffen, sowie ein Saugnapf zur Befestigung. Der Akku kann durch eine Schnellladetechnologie unter 1 Stunde geladen werden.</p><br /><p> </p><br /><p><strong>Merkmale im Überblick:</strong></p><br /><ul><br /><li>Hygienischer Badekomfort durch Silber-Ionen-Technik<br /><strong></strong></li><br /><li>Ergonomisch geformte Sitz- und Rückenflächen</li><br /><li>Per Handsteuerung stufenlos verstellbar</li><br /><li>Rückenlehne absenkbar bis 40°</li><br /></ul>;;
DZ-075167;;075167;Dietz;Höhenadapter für Kanjo Badewannenlifter;Badewannenlifter;30;1 Woche;https://www.brandvital.de/hohenadapter-fur-kanjo-badewanndenlifter.html;https://www.brandvital.de/pub/media/catalog/product/h/_/h_hen_sd_24.jpg;;;5.9500;5.9500;5.9500;5.9500;5.9500;5.9500;5.9500;5.9500;5.9500;5.9500;5.9500;;Set besteht aus 4 Stück. Höhenadapter 2 cm inkl. Sauger<br />Zubehör für Kanjo und Kanjo Silverline;;
DZ-477016;;477016;Dietz;Handsteuerung für Kanjo Badewannenlifter;Badehilfen > Für die Badewanne > Badewannenlifter;179;1 Woche;https://www.brandvital.de/handsteuerung-kanjo.html;https://www.brandvital.de/pub/media/catalog/product/h/a/handsteuerung_kanjo_sd24.jpg;;;0;0;0;0;0;0;0;0;0;0;0;;Handsteuerung (groß)  für den Badewannenlifter Kanjo inkl. Akku<br />(Ersatzteil)<br />;;
DZ-075166;;075166;Dietz;Seitenklappen Verbreiterung für Badewannenlifter ;Badehilfen;17.99;1 Woche;https://www.brandvital.de/seitenklappenverbreiterung-fur-badewannenlifter-kanjo.html;https://www.brandvital.de/pub/media/catalog/product/s/e/seitenklappe_sd24.png;https://www.brandvital.de/pub/media/catalog/product/s/e/seitenklappabweiser_sd24.jpg;;5.9500;5.9500;5.9500;5.9500;5.9500;5.9500;5.9500;5.9500;5.9500;5.9500;5.9500;;Seitenklappenabweiser als zubhör für den Badewannenlifter Kanjo und Kanjo Silverline. Ermöglicht eine Verbreiterung des Sitzes von 37,5 cm auf  71 cm.<br />;;
DZ-477018;;477018;Dietz;Sitzbezugset Kanjo Badewannenlifter;Badewannenlifter;24.99;1 Woche;https://www.brandvital.de/sitzbeszugset-kanjo-badewannenlifter.html;https://www.brandvital.de/pub/media/catalog/product/b/e/bezugset_kanjo_sd24.jpg;;;5.9500;5.9500;5.9500;5.9500;5.9500;5.9500;5.9500;5.9500;5.9500;5.9500;5.9500;;Bezugset für den Kanjo Badewannenlifter für Sitz- und Rückenteil<br />;;
GS-77712803;;77712803;sanabelle-medical;Urin-Beinbeutel U220;Pflege > Urinbeutel / Sekretbeutel > Urinbeutel;3.79;3-4 Tage;https://www.brandvital.de/urin-beinbeutel-u220.html;https://www.brandvital.de/pub/media/catalog/product/b/e/beibeutel_v220.jpg;;;5.9500;5.9500;5.9500;5.9500;5.9500;5.9500;5.9500;5.9500;5.9500;5.9500;5.9500;;3-Kammer-Urinbeutel mit 600 ml Volumen, 50 cm Schlauchlänge und zusätzlichem Konnektor für individuelle Schlauchkürzung.<br /><br />Bei diesem Beinbeutel sorgen die angenehme Vlies-Rückseite sowie das 3-Kammer-System für hohen Tragekomfort. Der Urin verteilt sich durch die inneren drei Kammern gleichmäßig im Beutel und trägt so unter der Kleidung wenig auf.<br /><br />Der Schlauch kann bei Bedarf auf eine individuelle Länge gekürzt und danach mit dem mitgelieferten, zweiten Konnektor verbunden werden. An den Beinbeutel kann außerdem ein Nachtbeutel angeschlossen werden.<br /><br />VE= 1 Stück;;
GS-77712804;;77712804;sanabelle-medical;Urin-Beinbeutel U240;Pflege > Urinbeutel / Sekretbeutel > Urinbeutel;5.9900;3-4 Tage;https://www.brandvital.de/urin-beinbeutel-u240.html;https://www.brandvital.de/pub/media/catalog/product/u/2/u240_sd24.jpg;;;5.9500;5.9500;5.9500;5.9500;5.9500;5.9500;5.9500;5.9500;5.9500;5.9500;5.9500;;Hochwertiger Urinbeutel mit 750 ml Volumen, 66 cm Schlauchlänge und Tropfkammer sowie Belüftungsfilter.<br /><br />Der Beinbeutel U240 verfügt über eine belüftete Tropfkammer. Er ist hochfunktional und durch seine Vlies-Rückseite angenehm am Bein zu tragen. Das Ablassventil ist leicht mit einer Hand bedienbar und kann nach Gebrauch in die Einstecklasche hochgesteckt werden.<br /><br />An den Beinbeutel kann außerdem ein Nachtbeutel angeschlossen werden.;;
CC-213800-1;;213800-1;Coloplast;Befestigungsbänder für Urinbeutel VE=2;Pflege > Urinbeutel / Sekretbeutel > Urinbeutel;7.99;3-4 Tage;https://www.brandvital.de/befestigungsbander-fur-urinbeutel-2er-pack.html;https://www.brandvital.de/pub/media/catalog/product/k/l/klettb_nder.jpg;https://www.brandvital.de/pub/media/catalog/product/k/l/klettb_nder_sd24.jpg;;5.9500;5.9500;5.9500;5.9500;5.9500;5.9500;5.9500;5.9500;5.9500;5.9500;5.9500;;Zur Befestigung von Beinbeuteln.<br />Passend für jeden Beinumfang. <br />Waschbar bis 60°C. <br />Klettverschluss und Knöpfe für Bein- und Mehrkammer-Beinbeutel<br /><br />VE=2 Stück;;
WM-13755;;13755;Löwenstein Medical;Adapter für Respiflo zum Anschluß an Flowmeter;Sauerstofftherapie;14.99;1 Woche;https://www.brandvital.de/respiflo-adapter-fur-sterilwassersystem.html;https://www.brandvital.de/pub/media/catalog/product/r/e/respiflo.jpg;;;5.9500;5.9500;5.9500;5.9500;5.9500;5.9500;5.9500;5.9500;5.9500;5.9500;5.9500;;Adapter für Respiflo zum Anschluß an Flowmeter.<br />;;
US-Rubens1;4052865303228;1134;Elbur;Nachttisch Rubens 1 mit abschwenkbarer Arbeitsplatte;Pflege > Pflegebetten und Zubehör > Pflegenachttische / Betttische ;348.0000;1-2 Wochen;https://www.brandvital.de/nachttisch-rubens.html;https://www.brandvital.de/pub/media/catalog/product/r/u/rubens1.jpg;;;0;0;0;0;0;0;0;0;0;0;0;;<p>Der Nachttisch Rubens wird im harmonischen Buchedekor ausgeliefert und und fügt sich optisch dezent in Ihr Schlafzimmer ein. Er verfügt neben einer Schublade, welche auf beiden Seiten ausziehbar ist, über ein Ablagefach und eine Tür mit zu verschließendem Abteil. Die ausschwenkbare Arbeits- und Ablagefläche in den Maßen (Tablettgröße: B/T 720 mm/360 mm), kann bei Nichtgebrauch problemlos an der Seite des Nachttisches eingeklappt werden und ist somit beim Transport nicht hinderlich. </p>;;
