SE-094-LA10-A03;04150001910009;SE-094-LA10-A03;TZMO Seni;Super Seni Trio Large;Pflege > Inkontinenz Produkte > Windelhosen;5.7900;3-4 Tage;https://www.brandvital.de/super-seni-trio-large-windelhosen.html;https://www.brandvital.de/pub/media/catalog/product/s/u/supersenitrio_m_0f5c2f88f23bd558821e8c13e4695fd4_2.png;https://www.brandvital.de/pub/media/catalog/product/s/u/supersenitrio_001_afe22da8af215ed1df911eebedc144c9_2.jpg;https://www.brandvital.de/pub/media/catalog/product/s/u/supersenitriopiktogram_medium_afe22da8af215ed1df911eebedc144c9_2.png;5.9500;5.9500;5.9500;5.9500;5.9500;5.9500;5.9500;5.9500;5.9500;5.9500;5.9500;;<p><span>Die atmungsaktive Inkontinenzhose Super SENI Trio ist die beste Lösung für Menschen mit schwerer bis sehr schwerer Blasenschwäche. Die Inkontinenzhosen Super SENI Trio garantiert:</span></p><br /><ul><br /><li>I<span>deale Anpassung an den Körper dank der elastischen Vorder- und Rückenseite sowie den elastischen Klebeklettverschlüssen</span></li><br /><li>s<span>chnelle Aufnahme der Flüssigkeit</span></li><br /><li><span>M<span>inimierung von unangenehmen Gerüchen</span></span></li><br /><li><span><span>S<span>icherheit dank dem seitlichen Auslaufschutz</span></span></span></li><br /><li><span><span><span>g<span>esunde Haut dank der atmungsaktiven Außenschicht</span></span></span></span></li><br /><li><span><span><span><span>m<span>ehrmaliges Öffnen und Schließen des Produktes</span></span></span></span></span></li><br /></ul><br /><div></div><br /><div><span style="text-decoration: underline ">Hinweis:</span></div><br /><div><span>Auf der Außenseite des Produktes befindet sich ein Nässeindikator, der über den Wechselbedarf informiert. Die Inkontinenzhosen sind geeignet sowohl bei Harn-, wie auch Stuhlinkontinenz.</span></div><br /><p></p><br /><p><span style="color: #ff6600 ">Bitte beachten Sie, dass versiegelte Waren <strong>nach Auspacken</strong>, aus Gründen des Gesundheitsschutzes oder der Hygiene nicht zur <em><strong><a title="Wideruf Info" href="https://www.brandvital.de/widerruf/" target="_blank"><span style="color: #ff6600 ">Rückgabe</span></a></strong></em> geeignet sind!</span></p><br />;;
SE-094-XL10-A03;05900516932510;SE-094-XL10-A03;TZMO Seni;Super Seni Trio Extra Large;Pflege > Inkontinenz Produkte > Windelhosen;6.8900;3-4 Tage;https://www.brandvital.de/super-seni-trio-xl-windelhosen.html;https://www.brandvital.de/pub/media/catalog/product/s/u/supersenitrio_m_0f5c2f88f23bd558821e8c13e4695fd4_3.png;https://www.brandvital.de/pub/media/catalog/product/s/u/supersenitrio_001_afe22da8af215ed1df911eebedc144c9_3.jpg;https://www.brandvital.de/pub/media/catalog/product/s/u/supersenitriopiktogram_medium_afe22da8af215ed1df911eebedc144c9_3.png;5.9500;5.9500;5.9500;5.9500;5.9500;5.9500;5.9500;5.9500;5.9500;5.9500;5.9500;;<p><span>Die atmungsaktive Inkontinenzhose Super SENI Trio ist die beste Lösung für Menschen mit schwerer bis sehr schwerer Blasenschwäche. Die Inkontinenzhosen Super SENI Trio garantiert:</span></p><br /><ul><br /><li>I<span>deale Anpassung an den Körper dank der elastischen Vorder- und Rückenseite sowie den elastischen Klebeklettverschlüssen</span></li><br /><li>s<span>chnelle Aufnahme der Flüssigkeit</span></li><br /><li><span>M<span>inimierung von unangenehmen Gerüchen</span></span></li><br /><li><span><span>S<span>icherheit dank dem seitlichen Auslaufschutz</span></span></span></li><br /><li><span><span><span>g<span>esunde Haut dank der atmungsaktiven Außenschicht</span></span></span></span></li><br /><li><span><span><span><span>m<span>ehrmaliges Öffnen und Schließen des Produktes</span></span></span></span></span></li><br /></ul><br /><div></div><br /><div><span style="text-decoration: underline ">Hinweis:</span></div><br /><div><span>Auf der Außenseite des Produktes befindet sich ein Nässeindikator, der über den Wechselbedarf informiert. Die Inkontinenzhosen sind geeignet sowohl bei Harn-, wie auch Stuhlinkontinenz.</span></div><br /><p></p><br /><p><span style="color: #ff6600 ">Bitte beachten Sie, dass versiegelte Waren <strong>nach Auspacken</strong>, aus Gründen des Gesundheitsschutzes oder der Hygiene nicht zur <em><strong><a title="Wideruf Info" href="https://www.brandvital.de/widerruf/" target="_blank"><span style="color: #ff6600 ">Rückgabe</span></a></strong></em> geeignet sind!</span></p><br />;;
SE-094-SM10-A04;05900516070083;SE-094-SM10-A04;TZMO Seni;Super Seni Quatro Small;Pflege > Inkontinenz Produkte > Windelhosen;5.8900;3-4 Tage;https://www.brandvital.de/super-seni-quatro-small-windelhosen.html;https://www.brandvital.de/pub/media/catalog/product/s/u/superseniquatro_m_0f5c2f88f23bd558821e8c13e4695fd4.png;https://www.brandvital.de/pub/media/catalog/product/s/u/superseniquatro_001_afe22da8af215ed1df911eebedc144c9.jpg;https://www.brandvital.de/pub/media/catalog/product/s/u/superseniquatropiktogram_medium_afe22da8af215ed1df911eebedc144c9.png;5.9500;5.9500;5.9500;5.9500;5.9500;5.9500;5.9500;5.9500;5.9500;5.9500;5.9500;;<p><span>Die atmungsaktive Inkontinenzhose Super SENI Quatro ist die beste Lösung für Menschen mit besonders schwerer Blasenschwäche. Die Inkontinenzhosen Super SENI Quatro garantieren:</span></p><br /><ul><br /><li>I<span>deale Anpassung an den Körper dank der elastischen Vorder- und Rückenseite sowie den elastischen Klebeklettverschlüssen</span></li><br /><li>s<span>chnelle Aufnahme der Flüssigkeit</span></li><br /><li><span>M<span>inimierung von unangenehmen Gerüchen</span></span></li><br /><li><span><span>S<span>icherheit dank dem seitlichen Auslaufschutz</span></span></span></li><br /><li><span><span><span>g<span>esunde Haut dank der atmungsaktiven Außenschicht</span></span></span></span></li><br /><li><span><span><span><span>m<span>ehrmaliges Öffnen und Schließen des Produktes</span></span></span></span></span></li><br /></ul><br /><div></div><br /><div><span style="text-decoration: underline ">Hinweis:</span></div><br /><div><span>Auf der Außenseite des Produktes befindet sich ein Nässeindikator, der über den Wechselbedarf informiert. Die Inkontinenzhosen sind geeignet sowohl bei Harn-, wie auch Stuhlinkontinenz.</span></div><br /><p></p><br /><p><span style="color: #ff6600 ">Bitte beachten Sie, dass versiegelte Waren <strong>nach Auspacken</strong>, aus Gründen des Gesundheitsschutzes oder der Hygiene nicht zur <em><strong><a title="Wideruf Info" href="https://www.brandvital.de/widerruf/" target="_blank"><span style="color: #ff6600 ">Rückgabe</span></a></strong></em> geeignet sind!</span></p>;;
SE-094-ME10-A04;04260467753086;SE-094-ME10-A04;TZMO Seni;Super Seni Quatro Medium;Pflege > Inkontinenz Produkte > Windelhosen;6.4900;3-4 Tage;https://www.brandvital.de/super-seni-quatro-medium-windelhosen.html;https://www.brandvital.de/pub/media/catalog/product/s/u/superseniquatro_m_0f5c2f88f23bd558821e8c13e4695fd4_1.png;https://www.brandvital.de/pub/media/catalog/product/s/u/superseniquatro_001_afe22da8af215ed1df911eebedc144c9_1.jpg;https://www.brandvital.de/pub/media/catalog/product/s/u/superseniquatropiktogram_medium_afe22da8af215ed1df911eebedc144c9_1.png;5.9500;5.9500;5.9500;5.9500;5.9500;5.9500;5.9500;5.9500;5.9500;5.9500;5.9500;;<p><span>Die atmungsaktive Inkontinenzhose Super SENI Quatro ist die beste Lösung für Menschen mit besonders schwerer Blasenschwäche. Die Inkontinenzhosen Super SENI Quatro garantieren:</span></p><br /><ul><br /><li>I<span>deale Anpassung an den Körper dank der elastischen Vorder- und Rückenseite sowie den elastischen Klebeklettverschlüssen</span></li><br /><li>s<span>chnelle Aufnahme der Flüssigkeit</span></li><br /><li><span>M<span>inimierung von unangenehmen Gerüchen</span></span></li><br /><li><span><span>S<span>icherheit dank dem seitlichen Auslaufschutz</span></span></span></li><br /><li><span><span><span>g<span>esunde Haut dank der atmungsaktiven Außenschicht</span></span></span></span></li><br /><li><span><span><span><span>m<span>ehrmaliges Öffnen und Schließen des Produktes</span></span></span></span></span></li><br /></ul><br /><div></div><br /><div><span style="text-decoration: underline ">Hinweis:</span></div><br /><div><span>Auf der Außenseite des Produktes befindet sich ein Nässeindikator, der über den Wechselbedarf informiert. Die Inkontinenzhosen sind geeignet sowohl bei Harn-, wie auch Stuhlinkontinenz.</span></div><br /><p></p><br /><p><span style="color: #ff6600 ">Bitte beachten Sie, dass versiegelte Waren <strong>nach Auspacken</strong>, aus Gründen des Gesundheitsschutzes oder der Hygiene nicht zur <em><strong><a title="Wideruf Info" href="https://www.brandvital.de/widerruf/" target="_blank"><span style="color: #ff6600 ">Rückgabe</span></a></strong></em> geeignet sind!</span></p><br />;;
SE-094-LA10-A04;05900516692865;SE-094-LA10-A04;TZMO Seni;Super Seni Quatro Large;Inkontinenz Produkte > Windelhosen;6.5900;3-4 Tage;https://www.brandvital.de/super-seni-quatro-quatro-windelhosen.html;https://www.brandvital.de/pub/media/catalog/product/s/u/superseniquatro_m_0f5c2f88f23bd558821e8c13e4695fd4_2.png;https://www.brandvital.de/pub/media/catalog/product/s/u/superseniquatro_001_afe22da8af215ed1df911eebedc144c9_2.jpg;https://www.brandvital.de/pub/media/catalog/product/s/u/superseniquatropiktogram_medium_afe22da8af215ed1df911eebedc144c9_2.png;5.9500;5.9500;5.9500;5.9500;5.9500;5.9500;5.9500;5.9500;5.9500;5.9500;5.9500;;<p><span>Die atmungsaktive Inkontinenzhose Super SENI Quatro ist die beste Lösung für Menschen mit besonders schwerer Blasenschwäche. Die Inkontinenzhosen Super SENI Quatro garantieren:</span></p><br /><ul><br /><li>I<span>deale Anpassung an den Körper dank der elastischen Vorder- und Rückenseite sowie den elastischen Klebeklettverschlüssen</span></li><br /><li>s<span>chnelle Aufnahme der Flüssigkeit</span></li><br /><li><span>M<span>inimierung von unangenehmen Gerüchen</span></span></li><br /><li><span><span>S<span>icherheit dank dem seitlichen Auslaufschutz</span></span></span></li><br /><li><span><span><span>g<span>esunde Haut dank der atmungsaktiven Außenschicht</span></span></span></span></li><br /><li><span><span><span><span>m<span>ehrmaliges Öffnen und Schließen des Produktes</span></span></span></span></span></li><br /></ul><br /><div></div><br /><div><span style="text-decoration: underline ">Hinweis:</span></div><br /><div><span>Auf der Außenseite des Produktes befindet sich ein Nässeindikator, der über den Wechselbedarf informiert. Die Inkontinenzhosen sind geeignet sowohl bei Harn-, wie auch Stuhlinkontinenz.</span></div><br /><p></p><br /><p><span style="color: #ff6600 ">Bitte beachten Sie, dass versiegelte Waren <strong>nach Auspacken</strong>, aus Gründen des Gesundheitsschutzes oder der Hygiene nicht zur <em><strong><a title="Wideruf Info" href="https://www.brandvital.de/widerruf/" target="_blank"><span style="color: #ff6600 ">Rückgabe</span></a></strong></em> geeignet sind!</span></p><br />;;
SE-094-XL10-A04;05900516981730;SE-094-XL10-A04;TZMO Seni;Super Seni Quatro Extra Large;Pflege > Inkontinenz Produkte > Windelhosen;8.2900;3-4 Tage;https://www.brandvital.de/super-seni-quatro-xl-windelhosen.html;https://www.brandvital.de/pub/media/catalog/product/s/u/superseniquatro_m_0f5c2f88f23bd558821e8c13e4695fd4_3.png;https://www.brandvital.de/pub/media/catalog/product/s/u/superseniquatro_001_afe22da8af215ed1df911eebedc144c9_3.jpg;https://www.brandvital.de/pub/media/catalog/product/s/u/superseniquatropiktogram_medium_afe22da8af215ed1df911eebedc144c9_3.png;5.9500;5.9500;5.9500;5.9500;5.9500;5.9500;5.9500;5.9500;5.9500;5.9500;5.9500;;<p><span>Die atmungsaktive Inkontinenzhose Super SENI Quatro ist die beste Lösung für Menschen mit besonders schwerer Blasenschwäche. Die Inkontinenzhosen Super SENI Quatro garantieren:</span></p><br /><ul><br /><li>I<span>deale Anpassung an den Körper dank der elastischen Vorder- und Rückenseite sowie den elastischen Klebeklettverschlüssen</span></li><br /><li>s<span>chnelle Aufnahme der Flüssigkeit</span></li><br /><li><span>M<span>inimierung von unangenehmen Gerüchen</span></span></li><br /><li><span><span>S<span>icherheit dank dem seitlichen Auslaufschutz</span></span></span></li><br /><li><span><span><span>g<span>esunde Haut dank der atmungsaktiven Außenschicht</span></span></span></span></li><br /><li><span><span><span><span>m<span>ehrmaliges Öffnen und Schließen des Produktes</span></span></span></span></span></li><br /></ul><br /><div></div><br /><div><span style="text-decoration: underline ">Hinweis:</span></div><br /><div><span>Auf der Außenseite des Produktes befindet sich ein Nässeindikator, der über den Wechselbedarf informiert. Die Inkontinenzhosen sind geeignet sowohl bei Harn-, wie auch Stuhlinkontinenz.</span></div><br /><p></p><br /><p><span style="color: #ff6600 ">Bitte beachten Sie, dass versiegelte Waren <strong>nach Auspacken</strong>, aus Gründen des Gesundheitsschutzes oder der Hygiene nicht zur <em><strong><a title="Wideruf Info" href="https://www.brandvital.de/widerruf/" target="_blank"><span style="color: #ff6600 ">Rückgabe</span></a></strong></em> geeignet sind!</span></p><br />;;
SE-097-ME10-001;05900516691882;SE-097-ME10-001;TZMO Seni;Seni Optima Medium;Pflege > Inkontinenz Produkte > Windelhosen;4.1900;3-4 Tage;https://www.brandvital.de/seni-optima-medium-windelhosen.html;https://www.brandvital.de/pub/media/catalog/product/s/e/senioptima_medium_0f5c2f88f23bd558821e8c13e4695fd4_2.png;https://www.brandvital.de/pub/media/catalog/product/o/p/optima_zalozony_afe22da8af215ed1df911eebedc144c9_2.png;https://www.brandvital.de/pub/media/catalog/product/s/e/senioptimapiktogram_afe22da8af215ed1df911eebedc144c9_2.png;5.9500;5.9500;5.9500;5.9500;5.9500;5.9500;5.9500;5.9500;5.9500;5.9500;5.9500;;<p><span>Die atmungsaktive Vorlage mit Hüftbund SENI Optima ist die beste Lösung für Menschen mit mittlerer Blasenschwäche. Die Vorlagen SENI Optima garantieren:</span></p><br /><ul><br /><li>I<span>deale Anpassung an den Körper dank der elastischen Vorder- und Rückenseite sowie den elastischen Klebeklettverschlüssen</span></li><br /><li>s<span>chnelle Aufnahme der Flüssigkeit</span></li><br /><li><span>M<span>inimierung von unangenehmen Gerüchen</span></span></li><br /><li><span><span>S<span>icherheit dank dem seitlichen Auslaufschutz</span></span></span></li><br /><li><span><span><span>g<span>esunde Haut dank der atmungsaktiven Außenschicht</span></span></span></span></li><br /><li>e<span>infaches Anlegen des Produktes ohne Hilfe dank der besonderen Konstruktion.</span></li><br /></ul><br /><div></div><br /><div><span style="text-decoration: underline ">Hinweis:</span></div><br /><div><span>Auf der Außenseite des Produktes befindet sich ein Nässeindikator, der über den Wechselbedarf informiert. Die Inkontinenzhosen sind geeignet sowohl bei Harn-, wie auch Stuhlinkontinenz.</span></div><br /><p></p><br /><p><span style="color: #ff6600 ">Bitte beachten Sie, dass versiegelte Waren <strong>nach Auspacken</strong>, aus Gründen des Gesundheitsschutzes oder der Hygiene nicht zur <em><strong><a title="Wideruf Info" href="https://www.brandvital.de/widerruf/" target="_blank"><span style="color: #ff6600 ">Rückgabe</span></a></strong></em> geeignet sind!</span></p>;;
SE-097-LA10-001;5900516691899;SE-097-LA10-001;TZMO Seni;Seni Optima Large;Pflege > Inkontinenz Produkte > Windelhosen;6.4900;3-4 Tage;https://www.brandvital.de/seni-optima-large-windelhosen.html;https://www.brandvital.de/pub/media/catalog/product/s/e/senioptima_medium_0f5c2f88f23bd558821e8c13e4695fd4_3.png;https://www.brandvital.de/pub/media/catalog/product/o/p/optima_zalozony_afe22da8af215ed1df911eebedc144c9_3.png;https://www.brandvital.de/pub/media/catalog/product/s/e/senioptimapiktogram_afe22da8af215ed1df911eebedc144c9_3.png;5.9500;5.9500;5.9500;5.9500;5.9500;5.9500;5.9500;5.9500;5.9500;5.9500;5.9500;;<p><span>Die atmungsaktive Vorlage mit Hüftbund SENI Optima ist die beste Lösung für Menschen mit mittlerer Blasenschwäche. Die Vorlagen SENI Optima garantieren:</span></p><br /><ul><br /><li>I<span>deale Anpassung an den Körper dank der elastischen Vorder- und Rückenseite sowie den elastischen Klebeklettverschlüssen</span></li><br /><li>s<span>chnelle Aufnahme der Flüssigkeit</span></li><br /><li><span>M<span>inimierung von unangenehmen Gerüchen</span></span></li><br /><li><span><span>S<span>icherheit dank dem seitlichen Auslaufschutz</span></span></span></li><br /><li><span><span><span>g<span>esunde Haut dank der atmungsaktiven Außenschicht</span></span></span></span></li><br /><li>e<span>infaches Anlegen des Produktes ohne Hilfe dank der besonderen Konstruktion.</span></li><br /></ul><br /><div></div><br /><div><span style="text-decoration: underline ">Hinweis:</span></div><br /><div><span>Auf der Außenseite des Produktes befindet sich ein Nässeindikator, der über den Wechselbedarf informiert. Die Inkontinenzhosen sind geeignet sowohl bei Harn-, wie auch Stuhlinkontinenz.</span></div><br /><p></p><br /><p><span style="color: #ff6600 ">Bitte beachten Sie, dass versiegelte Waren <strong>nach Auspacken</strong>, aus Gründen des Gesundheitsschutzes oder der Hygiene nicht zur <em><strong><a title="Wideruf Info" href="https://www.brandvital.de/widerruf/" target="_blank"><span style="color: #ff6600 ">Rückgabe</span></a></strong></em> geeignet sind!</span></p><br />;;
SE-097-XL10-001;05900516691905;SE-097-XL10-001;TZMO Seni;Seni Optima Extra Large;Pflege > Inkontinenz Produkte > Windelhosen;5.6900;3-4 Tage;https://www.brandvital.de/seni-optima-xl-windelhosen.html;https://www.brandvital.de/pub/media/catalog/product/s/e/senioptima_medium_0f5c2f88f23bd558821e8c13e4695fd4_4.png;https://www.brandvital.de/pub/media/catalog/product/o/p/optima_zalozony_afe22da8af215ed1df911eebedc144c9_4.png;https://www.brandvital.de/pub/media/catalog/product/s/e/senioptimapiktogram_afe22da8af215ed1df911eebedc144c9_4.png;5.9500;5.9500;5.9500;5.9500;5.9500;5.9500;5.9500;5.9500;5.9500;5.9500;5.9500;;<p><span>Die atmungsaktive Vorlage mit Hüftbund SENI Optima ist die beste Lösung für Menschen mit mittlerer Blasenschwäche. Die Vorlagen SENI Optima garantieren:</span></p><br /><ul><br /><li>I<span>deale Anpassung an den Körper dank der elastischen Vorder- und Rückenseite sowie den elastischen Klebeklettverschlüssen</span></li><br /><li>s<span>chnelle Aufnahme der Flüssigkeit</span></li><br /><li><span>M<span>inimierung von unangenehmen Gerüchen</span></span></li><br /><li><span><span>S<span>icherheit dank dem seitlichen Auslaufschutz</span></span></span></li><br /><li><span><span><span>g<span>esunde Haut dank der atmungsaktiven Außenschicht</span></span></span></span></li><br /><li>e<span>infaches Anlegen des Produktes ohne Hilfe dank der besonderen Konstruktion.</span></li><br /></ul><br /><div></div><br /><div><span style="text-decoration: underline ">Hinweis:</span></div><br /><div><span>Auf der Außenseite des Produktes befindet sich ein Nässeindikator, der über den Wechselbedarf informiert. Die Inkontinenzhosen sind geeignet sowohl bei Harn-, wie auch Stuhlinkontinenz.</span></div><br /><p></p><br /><p><span style="color: #ff6600 ">Bitte beachten Sie, dass versiegelte Waren <strong>nach Auspacken</strong>, aus Gründen des Gesundheitsschutzes oder der Hygiene nicht zur <em><strong><a title="Wideruf Info" href="https://www.brandvital.de/widerruf/" target="_blank"><span style="color: #ff6600 ">Rückgabe</span></a></strong></em> geeignet sind!</span></p><br />;;
SE-097-ME10-002;05900516691776;SE-097-ME10-002;TZMO Seni;Seni Optima Plus Medium;Pflege > Inkontinenz Produkte > Windelhosen;5.3900;3-4 Tage;https://www.brandvital.de/seni-optima-plus-medium-windelhosen.html;https://www.brandvital.de/pub/media/catalog/product/s/e/senioptimaplus_medium_0f5c2f88f23bd558821e8c13e4695fd4.png;https://www.brandvital.de/pub/media/catalog/product/s/e/senioptimapluspiktogram_afe22da8af215ed1df911eebedc144c9.png;;5.9500;5.9500;5.9500;5.9500;5.9500;5.9500;5.9500;5.9500;5.9500;5.9500;5.9500;;<p><span>Die atmungsaktive Vorlage mit Hüftbund SENI Optima Plus ist die beste Lösung für Menschen mit mittlerer bis schwerer Blasenschwäche. Die Vorlagen SENI Optima garantieren:</span></p><br /><ul><br /><li>I<span>deale Anpassung an den Körper dank der elastischen Vorder- und Rückenseite sowie den elastischen Klebeklettverschlüssen</span></li><br /><li>s<span>chnelle Aufnahme der Flüssigkeit</span></li><br /><li><span>M<span>inimierung von unangenehmen Gerüchen</span></span></li><br /><li><span><span>S<span>icherheit dank dem seitlichen Auslaufschutz</span></span></span></li><br /><li><span><span><span>g<span>esunde Haut dank der atmungsaktiven Außenschicht</span></span></span></span></li><br /><li>e<span>infaches Anlegen des Produktes ohne Hilfe dank der besonderen Konstruktion.</span></li><br /></ul><br /><div></div><br /><div><span style="text-decoration: underline ">Hinweis:</span></div><br /><div><span>Auf der Außenseite des Produktes befindet sich ein Nässeindikator, der über den Wechselbedarf informiert. Die Inkontinenzhosen sind geeignet sowohl bei Harn-, wie auch Stuhlinkontinenz.</span></div><br /><p></p><br /><p><span style="color: #ff6600 ">Bitte beachten Sie, dass versiegelte Waren <strong>nach Auspacken</strong>, aus Gründen des Gesundheitsschutzes oder der Hygiene nicht zur <em><strong><a title="Wideruf Info" href="https://www.brandvital.de/widerruf/" target="_blank"><span style="color: #ff6600 ">Rückgabe</span></a></strong></em> geeignet sind!</span></p>;;
SE-097-LA10-002;05900516691783;SE-097-LA10-002;TZMO Seni;Seni Optima Plus Large;Pflege > Inkontinenz Produkte > Windelhosen;6.0900;3-4 Tage;https://www.brandvital.de/seni-optima-plus-large-windelhosen.html;https://www.brandvital.de/pub/media/catalog/product/s/e/senioptimaplus_medium_0f5c2f88f23bd558821e8c13e4695fd4_1.png;https://www.brandvital.de/pub/media/catalog/product/s/e/senioptimapluspiktogram_afe22da8af215ed1df911eebedc144c9_1.png;;5.9500;5.9500;5.9500;5.9500;5.9500;5.9500;5.9500;5.9500;5.9500;5.9500;5.9500;;<p><span>Die atmungsaktive Vorlage mit Hüftbund SENI Optima Plus ist die beste Lösung für Menschen mit mittlerer bis schwerer Blasenschwäche. Die Vorlagen SENI Optima garantieren:</span></p><br /><ul><br /><li>I<span>deale Anpassung an den Körper dank der elastischen Vorder- und Rückenseite sowie den elastischen Klebeklettverschlüssen</span></li><br /><li>s<span>chnelle Aufnahme der Flüssigkeit</span></li><br /><li><span>M<span>inimierung von unangenehmen Gerüchen</span></span></li><br /><li><span><span>S<span>icherheit dank dem seitlichen Auslaufschutz</span></span></span></li><br /><li><span><span><span>g<span>esunde Haut dank der atmungsaktiven Außenschicht</span></span></span></span></li><br /><li>e<span>infaches Anlegen des Produktes ohne Hilfe dank der besonderen Konstruktion.</span></li><br /></ul><br /><div></div><br /><div><span style="text-decoration: underline ">Hinweis:</span></div><br /><div><span>Auf der Außenseite des Produktes befindet sich ein Nässeindikator, der über den Wechselbedarf informiert. Die Inkontinenzhosen sind geeignet sowohl bei Harn-, wie auch Stuhlinkontinenz.</span></div><br /><p></p><br /><p><span style="color: #ff6600 ">Bitte beachten Sie, dass versiegelte Waren <strong>nach Auspacken</strong>, aus Gründen des Gesundheitsschutzes oder der Hygiene nicht zur <em><strong><a title="Wideruf Info" href="https://www.brandvital.de/widerruf/" target="_blank"><span style="color: #ff6600 ">Rückgabe</span></a></strong></em> geeignet sind!</span></p><br />;;
SE-097-XL10-002;05900516691912;SE-097-XL10-002;TZMO Seni;Seni Optima Plus Extra Large;Pflege > Inkontinenz Produkte > Windelhosen;6.9900;3-4 Tage;https://www.brandvital.de/seni-optima-plus-xl-windelhosen.html;https://www.brandvital.de/pub/media/catalog/product/s/e/senioptimaplus_medium_0f5c2f88f23bd558821e8c13e4695fd4_2.png;https://www.brandvital.de/pub/media/catalog/product/s/e/senioptimapluspiktogram_afe22da8af215ed1df911eebedc144c9_2.png;;5.9500;5.9500;5.9500;5.9500;5.9500;5.9500;5.9500;5.9500;5.9500;5.9500;5.9500;;<p><span>Die atmungsaktive Vorlage mit Hüftbund SENI Optima Plus ist die beste Lösung für Menschen mit mittlerer bis schwerer Blasenschwäche. Die Vorlagen SENI Optima garantieren:</span></p><br /><ul><br /><li>I<span>deale Anpassung an den Körper dank der elastischen Vorder- und Rückenseite sowie den elastischen Klebeklettverschlüssen</span></li><br /><li>s<span>chnelle Aufnahme der Flüssigkeit</span></li><br /><li><span>M<span>inimierung von unangenehmen Gerüchen</span></span></li><br /><li><span><span>S<span>icherheit dank dem seitlichen Auslaufschutz</span></span></span></li><br /><li><span><span><span>g<span>esunde Haut dank der atmungsaktiven Außenschicht</span></span></span></span></li><br /><li>e<span>infaches Anlegen des Produktes ohne Hilfe dank der besonderen Konstruktion.</span></li><br /></ul><br /><div></div><br /><div><span style="text-decoration: underline ">Hinweis:</span></div><br /><div><span>Auf der Außenseite des Produktes befindet sich ein Nässeindikator, der über den Wechselbedarf informiert. Die Inkontinenzhosen sind geeignet sowohl bei Harn-, wie auch Stuhlinkontinenz.</span></div><br /><p></p><br /><p><span style="color: #ff6600 ">Bitte beachten Sie, dass versiegelte Waren <strong>nach Auspacken</strong>, aus Gründen des Gesundheitsschutzes oder der Hygiene nicht zur <em><strong><a title="Wideruf Info" href="https://www.brandvital.de/widerruf/" target="_blank"><span style="color: #ff6600 ">Rückgabe</span></a></strong></em> geeignet sind!</span></p><br />;;
