HP-37250;;37250;ResMed;BiLevelS Gerät AirCurve 10 S ;Spezialgeräte;1990.0000;1 Woche;https://www.brandvital.de/aircurve-10-cs-pace-wave.html;https://www.brandvital.de/pub/media/catalog/product/3/7/37250_1.jpg;;;0;0;0;0;0;0;0;0;0;0;0;;<p>Die Therapiegeräte der AirCurve 10 Serie basieren auf der renommierten BiLevel-Technologie (VPAP) von Resmed und unterstützen bei der Behandlung besonders anspruchsvoller OSA-Patienten. Mit neuem modernen Design und weiter vereinfachter Bedienung bieten die AirCurve Geräte neben intergrierter Funktechnologie je nach Modell eine automatische Druckanpassung (VAuto).</p><br /><p>AirCurve 10S - komfortable BiLevel-Therapie bei obstruktiver Schlafapnoe</p><br /><ul><br /><li>der S-Modus bietet eine klassische rechteckige Druckkurve mit zwei einstellbaren Druckniveaus (IPAP/EPAP)</li><br /><li>die optionale feste Backup-Frequenz von 10 Atemzügen/Minute sorgt für eine zeitliche Begrenzung von Apnoen.</li><br /></ul><br /><div style="left: 1062.99px  top: 1014.97px  font-size: 23.3333px  font-family: sans-serif  transform: scaleX(0.895969)  text-align: left "></div><br /><p><strong>Modi im Überblick:</strong></p><br /><ul><br /><li>CPAP / S</li><br /></ul><br /><p> </p><br /><p><strong>Um Ihr Therapiegerät individuell einstellen zu können, wählen Sie bitte die Option "Mit Aufbauservice und Einstellung". Bitte halten Sie für die individuelle Einstellung die Verordnung Ihres Arztes oder Ihren Patientenpass bei Lieferung bereit.</strong></p>;;
WM-29920-2110;;29920-2110;Löwenstein Medical;Prisma 25 ST Bilevel Therapie;CPAP - Schlafapnoe > BiLevel Systeme;2490;1 Woche;https://www.brandvital.de/prisma-25-st.html;https://www.brandvital.de/pub/media/catalog/product/p/r/prisma_25st.jpg;;;0;0;0;0;0;0;0;0;0;0;0;;<p>Das Prisma 25 ST Bilevel St Gerät von LÖWENSTEIN medical ist konzipiert für Patienten mit obstruktiver, gemischter oder komplexer Schlafapnoe mit Komorbiditäten. Ob Sie eine flexible oder indikationsgerechte Voreinstellung (SCOPES) nutzen möchten, das Prisma 25 ST ermöglicht Ihnen eine individuell passende Lösung. Automatische Hintergrundfrequenzen, Apnoedifferenz mit FOT sowie die zahlreichen Komfortfunktionen machen es zu einem flüsterleisem, sicherem und effektivem Therapiegerät.</p><br /><p> </p><br /><p><strong>Merkmale im Überblick:</strong></p><br /><p><strong><br /></strong></p><br /><ul><br /><li>Großer Druckbereich 4 - 25 hPa</li><br /><li>Zahlreiche Einstellparameter für mehr flexibilität in der Einstellung</li><br /><li>SCOPES (indikationsgerechte Voreinstellung) sorgt für einen schnellen Therapieerfolg</li><br /><li>Sicherheit durch automatische Hintergrundfrequenz</li><br /><li>Höher einstellbare feste Hintergrundfrequenz</li><br /><li>Sichere Technik unterscheidet obstruktive und zentrale Apnoen (FOT)</li><br /><li>Sehr leise auch bei höheren Drücken</li><br /></ul><br /><p> </p><br /><p> <strong>Lieferumfang:</strong></p><br /><ul><br /><li>Prisma 25 ST Grundgerät</li><br /><li>Transsporttasche</li><br /><li>Atemschlauch</li><br /><li>Netzteil</li><br /><li>Netzanschlussleitung</li><br /><li>Set Luftfilter</li><br /><li>SD-Karte</li><br /><li>Versandtasche für SD-Karte</li><br /></ul><br /><p> </p><br /><div class="box-collateral-content"><br /><div class="std"><br /><p><strong>Um Ihr Therapiegerät individuell einstellen zu können, wählen Sie bitte die Option "Mit Aufbauservice und Einstellung". Bitte halten Sie für die individuelle Einstellung die Verordnung Ihres Arztes oder Ihren Patientenpass bei Lieferung bereit.</strong></p><br /></div><br /></div>;;
WM-29960-2110;;29960;Löwenstein Medical;Prisma CR;Spezialgeräte;5950.0000;1 Woche;https://www.brandvital.de/prisma-25-cr.html;https://www.brandvital.de/pub/media/catalog/product/p/r/prismacr.jpg;;;0;0;0;0;0;0;0;0;0;0;0;;<p>Das AcSV Therapeigerät Prisma CR von LÖWENSTEIN medical eignet sich besonders für Patienten mit einer periodischen Atmung wie z.B Cheyne-Stokes-Atmung, sowie zentralen, gemischten bzw. komplexen Atmungsstörungen. Durch den neu validierten Algorithmus lassen sich periodische Atmungen schnell und zuverlässig therapieren. Das gelingt mit einer zielvolumenabhängigen Hintergrundfrequenz in Kombination mit der Intra-Atemzugregelung. Durch die antizyklische Servoventilation (AcSV) wird eine Bedarfsgerechte Druckunterstützung während des des aktuellen Atemzugs gewährleistet. </p><br /><p>Das Prisam CR bietet eine vielzahl an Möglichkeiten auch bei großen Druckbereichen ( 4- 30 hPa). Die zahlreichen Einstellparameter sorgen für mehr flexibilität in der Therapieeinstellung und sind zudem präzise bei der Indentifikation von periodischer Atmung, RERA, Schnarchen, Hypopnoen und bei der Flusslimitation.</p><br /><p>Sie erhalten einen schnellen Überblick für bis zu 14 Tage durch die hochauflösenden Therapiedaten, ebenso können Sie für 366 Tage Prozessunterstützend Ihre Statistikdaten erheben.   </p><br /><p> </p><br /><p><strong>Lieferumfang im Überblick:</strong></p><br /><ul><br /><li>Prisma CR Grundgerät</li><br /><li>Transporttasche</li><br /><li>Atemschlauch</li><br /><li>Netzteil</li><br /><li>Netzanschlussleitung</li><br /><li>2 Luftfilter</li><br /><li>SD-Karte</li><br /><li>Versandtasche für SD-Karte</li><br /></ul><br /><p> </p><br /><p><strong>Um Ihr Therapiegerät individuell einstellen zu können, wählen Sie bitte die Option "Mit Aufbauservice und Einstellung". Bitte halten Sie für die individuelle Einstellung die Verordnung Ihres Arztes oder Ihren Patientenpass bei Lieferung bereit.</strong></p>;;
HP-36122;4250649112077;36122;ResMed;S9 Escape Auto APAP;Auto CPAP Systeme;985.9000;1 Woche;https://www.brandvital.de/s9-escape-auto.html;https://www.brandvital.de/pub/media/catalog/product/s/9/s9_escape_auto.jpg;;;0;0;0;0;0;0;0;0;0;0;0;;<p>Das S9 Escape Auto APAP Schlaftherapiegerät bietet Ihnen optimale Effizienz für die selbstregulierende Therapie bei obstruktiven Schlafapnoen (OSA). Durch den APAP Algorithmus reagiert das S9 Escape auf Flusslimitationen, Schnarchen und Apnoen, so stellt es Ihnen immer jeweils den notwendigen Therapiedruck bereit. Eine Rampe ermöglicht Ihnen ruhig und bequem einzuschlafen. Das Climate Control bietet Ihnen optimale Temperaturkontrolle und Feuchte sowie höchsten Komfort.</p><br /><p>Über Atemschlauch und Maske weitergeleitete Geräusche werden durch die Easy-Breathe-Motortechnologie abgestrahlt und ermöglichen Ihnen eine fast Geräuschlose Therapie.</p><br /><p>Das Gerät kann in 5 Sprachen eingestellt werden: Deutsch, Englisch, Russisch, Türkisch und Polnisch. </p><br /><p> </p><br /><p>Lieferumfang im Überblick:</p><br /><ul><br /><li>S9 Escape Auto Grundgerät</li><br /><li>Standard Schlauch (19 mm)</li><br /><li>Filter</li><br /></ul><br /><p> </p><br /><p><strong>Um Ihr Therapiegerät individuell einstellen zu können, wählen Sie bitte die Option "Mit Aufbauservice und Einstellung". Bitte halten Sie für die individuelle Einstellung die Verordnung Ihres Arztes oder Ihren Patientenpass bei Lieferung bereit.</strong></p>;;
HP-36810;0619498368105;36810;ResMed;Atemschlauch SlimLine;CPAP Systeme Zubehör;35;1 Woche;https://www.brandvital.de/atemschlauch-slimline.html;https://www.brandvital.de/pub/media/catalog/product/s/l/slimline.png;;;5.9500;5.9500;5.9500;5.9500;5.9500;5.9500;5.9500;5.9500;5.9500;5.9500;5.9500;;<p>Das neue Schlauchsystem SlimLine von ResMed ist leichter und deutlich flexibler als ein Standardschlauch, dies bewirkt einen geringeren Zug auf Ihre Maske und sorgt für unbeeinträchtigten Schlaf. Der Atemschlauch ist 40% leichter und 20% dünner als die gängigen Standardschäuche und eignet sich auch hervorragend für Reisen.</p><br /><p><strong>Das SlimLine Schlauchsystem ist kompatibel mit der ResMed S9 und S10-Geräteserie.</strong></p>;;
WM-24445;;24445;Medutek;CPAP Atemschlauch 1,80 m;CPAP Systeme Zubehör;14.9;1-2 Tage;https://www.brandvital.de/cpap-atemschlauch-1-8-m.html;https://www.brandvital.de/pub/media/catalog/product/c/p/cpap_atemschlauch.jpg;;;5.9500;5.9500;5.9500;5.9500;5.9500;5.9500;5.9500;5.9500;5.9500;5.9500;5.9500;;<p>Der CPAP Atemschlauch ist passend für alle gängigen Schlaftherapiegeräte und hat eine länge von 1,8 m. Er besteht aus Polyolefin Plastomer und ist latexfrei. Der Atemschlauch ist geeignet für die Anwendung mit Atemtherapie-, IPPB- und CPAP-Geräten mit konischen 22 mm ISO-Anschlüssen.</p>;;
WM-29045;;061-183019;Medutek;Medutherm CPAP-Schlauch, beheizbar;Medizintechnik > CPAP - Schlafapnoe > CPAP Systeme Zubehör;69.0000;1-2 Tage;https://www.brandvital.de/hybernite-superday-atemschlauchsystem.html;https://www.brandvital.de/pub/media/catalog/product/h/y/hybernite1.jpg;;;0;0;0;0;0;0;0;0;0;0;0;;<p>Der beheizte Beatmungsschlauch MEDUTHERM hilft, Kondensation in Beatmungsschläuchen für erwachsene Patienten, die eine Beatmung mit positivem Luftdruck oder eine Maskenventilierung benötigen, zu vermeiden. Das System besteht aus einem beheizten Beatmungsschlauch und einer unabhängigen Energieversorgung. Das System kann im Schlaflabor und zu Hause eingesetzt werden.</p><br /><p><span></span></p><br /><p>Der Atemschlauch ist universell einsetzbar und einfach zum Nachrüsten geeignet. Er ist kompatibel für alle Schlaftherapiegeräte mit Luftbefeuchter und Atemschlauch ohne Druckmessschlauch. Der Geräteausgang sollte einen Durchmesser von 22 cm haben. Über den optional erhältlichen Netzschalter lässt sich das Schlauchsystem bequem EIn- und Ausschalten.</p><br /><p><strong>Lieferumfang im Überblick:</strong></p><br /><ul><br /><li>1 Atemschlauch</li><br /><li>Netzstecker</li><br /></ul>;;
HP-36995;;36995;ResMed;ClimateLine beheizbarer Atemschlauch H5i;Medizintechnik > CPAP - Schlafapnoe > CPAP Systeme Zubehör;75;1 Woche;https://www.brandvital.de/climateline-beheizbarer-atemschlauch.html;https://www.brandvital.de/pub/media/catalog/product/c/l/climateline1.jpg;https://www.brandvital.de/pub/media/catalog/product/c/l/climate_line_02.png;;0;0;0;0;0;0;0;0;0;0;0;;<p>Der ClimateLine Atemschlauch ist beheizbar und kann nur in Verbindung mit dem H5i Luftbefeuchter der S9 Geräte-Serie verwendet werden. Das Schlauchsystem von ResMed ist 40% leichter und 20% dünner als alle gängigen Standardschäuche. Der ClimateLine-Schlauch hält die Temperatur die Ihnen zugeführt wird konstant und vermeidet dadurch die Kondensation, sollte die Raumtemperatur während der Nacht absinken. So bleibt die Luftfeuchtigkeit für Sie dauerhaft angenehm.</p>;;
HP-37296;619498372966 ;37296;ResMed;ClimateLineAir beheizbarer Atemschlauch ;Medizintechnik > CPAP - Schlafapnoe > CPAP Systeme Zubehör;75;1 Woche;https://www.brandvital.de/climatelineair-beheizbarer-atemschlauch.html;https://www.brandvital.de/pub/media/catalog/product/c/l/climateline_air.png;;;0;0;0;0;0;0;0;0;0;0;0;;<p>Mit dem beheizbaren Atemschlauch ClimateLineAir von ResMed können Sie Ihre Maske auf die gewünschte Temperatur erwärmen. Der Atemschlauch wird direkt an Ihrem <strong>AirSense 10</strong> Schlaftherapiegerät angeschlossen, einen zusätzlichen Luftbefeuchter benötigen Sie dann nicht mehr. Die Ihnen zugeführte Luft wird konstant auf der von Ihnen gewünschten Temperatur gehalten, dadurch werden Kondensationen im Schlauch zuverlässig vermieden, auch wenn die Raumtemperatur während der Nacht mal absinken sollte. </p><br /><p>Wenn Sie unter trockener Nase oder einem trockenem Mund bzw. Kondensat in der Maske neigen, empfiehlt es sich einen beheizbaren Atemschlauch in Betracht zu ziehen.   </p><br /><p> </p><br /><p><strong>Lieferumfang im Überblick:</strong></p><br /><ul><br /><li>1 ResMed ClimateLineAir beheizbares Schlauchsystem</li><br /></ul>;;
HP-0701-36917;4250649150161;0701-36917;ResMed;H5i ClimateLine Kit;CPAP Systeme Zubehör;245;1 Woche;https://www.brandvital.de/h5i-climate-line-kit.html;https://www.brandvital.de/pub/media/catalog/product/w/a/warmluftbefeuchter_h5i_1.jpg;;;0;0;0;0;0;0;0;0;0;0;0;;<p>Mit dem H5i ClimateLine Kit haben Sie den beheizbaren Atemschlauch ClimateLine und den Warmluftbefeuchter H5i für Ihre S9 Serie von ResMed in einem Set. Beide Komponenten ergänzen einfach und bequem Ihr vorhandenes Schlaftherapiegerät. </p><br /><p><span>Für die wirksame Atemluftbefeuchtung mit konstanter Feuchtezufuhr ist der ResMed H5i Luftbefeuchter bestens geeignet und stellt eine sinnvolle Ergänzung für Ihr Therapiegerät (aus der S9-Serie) dar. Sie können ihn einfach an Ihr Therapiegerät integrieren.</span></p><br /><p><span>Das Atemschlauchsystem ClimateLine ist 40% leichter und 20% dünner als alle Standardschäuche und hält die Temperatur, der Luft die Ihnen zugeführt wird konstant. Dadurch wird Kondensation vermindert, sollte die Raumtemperatur während der Nacht absinken. So bleibt die Luftfeuchtigkeit für Sie dauerhaft angenehm. </span></p><br /><p><span><br /></span></p><br /><p><strong>Lieferumfang im Überblick:</strong></p><br /><ul><br /><li>ResMed Luftbefeuchter H5i Grundgerät</li><br /><li>ClimateLine beheizter Atemschlauch (190 cm lang und 15 mm Durchmesser)</li><br /></ul><br /><p> </p>;;
GA-LEO;04055296280298;AFB0000;Invacare;Scooter Leo;Mobilität > Elektromobile und Zubehör > Elektromobile;1389.0000;2-3 Wochen;https://www.brandvital.de/scooter-leo-1078.html;https://www.brandvital.de/pub/media/catalog/product/i/n/invacare_leo_silber_1.jpg;https://www.brandvital.de/pub/media/catalog/product/i/n/invacare_leo_silber_1.jpg;;0;0;0;0;0;0;0;0;0;0;0;;<p>Der Scooter Leo von Invacare ist einfach zu bedienen und überzeugt durch seine wendigen und sehr komfortablen Abmessungen. Mit dem kraftvollem Motor sind Reichweiten von bis zu 38 km kaum ein Problem. Die neuen komfortablen Sitze und die einstellbare Lenksäule ermöglichen Ihnen eine ergonomische Sitzposition. Zudem lässt sich der Scooter bei Bedarf schnell und ohne Werkzeug zerlegen. Ein Transport im Kofferraum Ihres Autos ist somit problemlos möglich.</p><br /><p>Der Scooter Leo ist 6 km/h schnell und ist geeignet für ein Personengewicht bis zu <strong>136 kg.</strong></p><br /><p>Serienmäßige Bremslichter und helle Scheinwerfer sorgen für eine sichere Fahrt im Dunkeln, ebenso die Motorbremse. Das Bedienpult lässt sich einfach bedienen und gibt bei Tastendruck ein akustisches Signal.</p>;;
RHS-1200T2;;1200T2;Rehasense;Rollstuhlrampe  120 cm;Mobilität > Rampen - Auffahrschienen;290.9;1 Woche;https://www.brandvital.de/rollstuhlrampe-120-cm.html;https://www.brandvital.de/pub/media/catalog/product/1/2/1200t2_kopie.jpg;https://www.brandvital.de/pub/media/catalog/product/r/o/rollstuhlrampen3.jpg;https://www.brandvital.de/pub/media/catalog/product/r/o/rollstuhlrampen1.jpg;0;0;0;0;0;0;0;0;0;0;0;;<p>Die Rollstuhlrampe Pondus ist eine praktische und hochfeste Aluminiumrampe. Sie teleskopierbar in zwei Teilen und kann so den örtlichen Gegebenheiten angepasst und nach der Verwendung problemlos verstaut werden. Sie können mit dieser Alurampe eine maximale Stufenhöhe von 24 cm überwinden. Das obere Rampenende ist mit rutschfestem Material versehen, sodass eine sichere Verwendung gewährleistet wird. Kunststoffgleitlager sorgen für reibungsloses und einfaches ineinander schieben der Rampenteile. Die max. Länge beträgt 120 cm. Zusamengefaltet hält eine Sicherungssperre die einzelnen Elemente zusammen, durch einen ergonomischen Tragegriff lässt sich die Rollstuhlrampe Pondus einfach transportieren und leicht verstauen.</p><br /><p> </p><br /><p><strong>Lieferumfang:</strong> 2 Rampen</p>;;
RHS-2000T3;;2000T3;Rehasense;Teleskoprampe 200 cm;Mobilität > Rampen - Auffahrschienen;280.99;1 Woche;https://www.brandvital.de/teleskoprampe-200-cm.html;https://www.brandvital.de/pub/media/catalog/product/2/0/2000t3_kopie_kopie.jpg;https://www.brandvital.de/pub/media/catalog/product/r/o/rollstuhlrampen2_1.jpg;https://www.brandvital.de/pub/media/catalog/product/r/o/rollstuhlrampen3_1.jpg;0;0;0;0;0;0;0;0;0;0;0;;<p>Mit der Teleskoprampe können Sie problemlos Stufenhöhen bis zu 40 cm bewältigen. Die Rollstuhlrampe ist teleskopierbar und passt sich so den örtlichen Gegebenheiten an. Durch die Kunststoffgleitlager lassen sich, die drei Teile der Teleskoprampe einfach ineinander verschieben, und durch die Sicherungssperre sowie dem ergonomischen Haltegriff einfach transportieren. Die maximale Länge der Teleskoprampe beträgt 200 cm und ist bis zu 300 kg belastbar. Die Alurampe ist leicht zu handhaben und ist durch ihre leichte Bauweise von geringem Eigengewicht. Die Rampenenden sind rutschfest und durch die gelochte Fahrfläche kann Regenwasser ungehindert abfließen.</p><br /><p> </p><br /><p>Lieferumgfang: 2 Stück</p><br /><p> </p>;;
RHS-2900T3;;2900T3;Rehasense;Teleskopierbare Rollstuhlrampe 290 cm;Mobilität > Rampen - Auffahrschienen;349.99;1 Woche;https://www.brandvital.de/teleskopierbare-rollstuhlrampe-290-cm.html;https://www.brandvital.de/pub/media/catalog/product/t/e/teleskoprampe_290.jpg;https://www.brandvital.de/pub/media/catalog/product/r/o/rollstuhlrampen2_2.jpg;https://www.brandvital.de/pub/media/catalog/product/r/o/rollstuhlrampen3_2.jpg;0;0;0;0;0;0;0;0;0;0;0;;<p>Die maximale Länge der teleskopierbare Rollstuhlrampe beträgt 290 cm. Mit dieser schaffen Sie problemlos Stufenhöhen bis max. 58 cm. Die drei einzelnen Elemete sind praktisch durch Gleitlager ineinander verschiebbar. Mit der Sicherungssperre lässt sich die Rampe feststellen und mit dem ergonomisch geformten Handgriff transportieren. Im oberen Teil der Rampe sorgte eine rutschfeste Unterlage für sicheren Halt. Die gelöcherte Fahrfläche lässt Regenwasser ungehindertabfließen. Die Teleskoprampe ist bis zu 300 kg belastbar trotz ihres geringem Eigengewichtes. </p><br /><p> </p><br /><p>Lieferumgfang: 2 Stück</p><br /><p> </p>;;
RHS-HRSGL600;5901912634138;HRSGL600;Rehasense;Rollator Server HD;Mobilität > Rollatoren und Zubehör > Rollatoren;199.0000;3-4 Tage;https://www.brandvital.de/rollator-server-hd.html;https://www.brandvital.de/pub/media/catalog/product/r/e/rehasense-serverhd.jpg;https://www.brandvital.de/pub/media/catalog/product/r/e/rehasense_serverhd3side_1.jpg;https://www.brandvital.de/pub/media/catalog/product/r/e/rehasense_serverhd2grey_1.jpg;0;0;0;0;0;0;0;0;0;0;0;;<h2><span style="color: #000000 ">Belastbar und leicht</span></h2><br /><p><span style="color: #000000 ">Der Server HD Rollator ist mit seinem Besonders breiten Rahmen kräftig gebaut und wiegt weniger als 8 kg. </span></p><br /><h2><span style="color: #000000 ">Komfort und Sicherheit</span></h2><br /><p><span style="color: #000000 ">Der Server HD ist klappbar und lässt sich unterwegs gut mitnehmen. Das neue Verschlusssystem ermöglicht das stehen des Server HD im geklappten Zustand und dient dem Benutzer als Komfort.</span></p><br /><p><span style="color: #000000 ">Der Rahmen und der Sitz des Rollators wurden sachgemäß getestet und sind für ein maximales Benutzergewicht von 200 kg ausgelegt. Die Bremsen des Server HD Rollators sind leicht zu betätigen und arbeiten zuverlässig. In Kombination mit den Bruchfesten Rädern, die mit mehreren Schichten TPE bedeckt sind, erreichen wir die bestmögliche Sicherheit für den Benutzer.</span><span style="color: #000000 "><br /></span></p><br /><h2><span style="color: #000000 ">Individuell anpassbar</span></h2><br /><p><span style="color: #000000 ">Die Server HD Schiebegriffe sind, je nach Belieben, höhenverstellbar auf bis zu 10 verschiedenen Positionen, von 74 cm bis 102 cm. Die Sitzhöhe beträgt 62 cm mit einer besonders breiten Sitzgrundlage von 55 cm.</span></p><br /><p><span style="color: #000000 ">Das optimale Rahmendesign und die ergonomische Schiebegriffe garantieren den Benutzerkomfort.</span><span style="color: #000000 "><br /></span></p><br /><h2><span style="color: #000000 ">Ergonomische Griffe Server HD </span><strong><span style="color: #000000 ">      </span></strong></h2><br /><p><span style="color: #000000 ">Die ergonomisch geformten Griffe des Server HD dienen für die korrekte und bestmögliche Positionierung der Hand.</span></p>;;
RHS-CRBKL600;4250649118475;CRBKL600;Rehasense;Leichtgewichtsrollator Athlon SL aus Carbon;Mobilität > Rollatoren und Zubehör > Leichtgewichtsrollatoren;299.0000;1-2 Tage;https://www.brandvital.de/rollator-athlon-sl.html;https://www.brandvital.de/pub/media/catalog/product/r/e/rehasense-athlon-leichtgewichtrollator.png;https://www.brandvital.de/pub/media/catalog/product/a/t/athlon-geklappt.jpg;https://www.brandvital.de/pub/media/catalog/product/r/e/rehasense-athlon.jpg;0;0;0;0;0;0;0;0;0;0;0;;<h2><span style="color: #000000 ">Eleganz und Leistung durch Carbon-Technologie</span></h2><br /><p>Die Athlon Rollatoren überzeugen nicht nur durch Ihre Kohlefaser-Technologie, sondern auch durch ihrem Leichtgewicht. Mit grade mal weniger als 5,5 kg ist er für die Benutzung bis max. 150 kg ausgelegt.<span style="color: #000000 "> Dank seines leichten Gewichts lässt er sich einfach heben.</span></p><br /><h2><span style="color: #000000 ">Komfortabel unterwegs mit dem Athlon Rollator</span></h2><br /><p><span style="color: #000000 ">Die Athlons sind klappbar und bleiben, dank dem neuen Verschlusssystem, in geklappter Position stehen. Das neue ergonomische Design sichert den einfachen Transport.</span></p><br /><h2><span style="color: #000000 ">Beanspruchbar </span></h2><br /><p><span style="color: #000000 ">Der Rahmen und der Sitz des Rollators wurden geprüft und sind für ein maximales Gewicht von 150 kg zugelassen. Die einfachen bedienbaren und zuverlässigen Bremsen mit bruchfesten Rädern, die mit TPE Schichten bedeckt sind, sorgen für Stabilität und Sicherheit.</span></p><br /><h2><span style="color: #000000 ">Flexibel anpassbar</span></h2><br /><p><span style="color: #000000 ">Die Athlon Schiebegriffe sind je nach Belieben, in 10 Positionen höhenverstellbar. Ebenfalls ist der Sitz des Athlon in drei unterschiedlichen Sitzhöhen - 62, 55 und 50 cm- erhältlich um den bestmöglichen Benutzerkomfort zu gewährleisten. </span></p><br /><h2><span style="color: #000000 ">Ergonomische geformte Griffe</span></h2><br /><p><span style="color: #000000 ">Die speziell angefertigten Griffe des Athlon sorgen für die korrekte Positionierung der Hand und für eine ergonomische Haltung.</span></p>;;
RHS-ERWHL600;5901912634671;ERWHL600;Rehasense;Rollator Explorer ;Mobilität > Rollatoren und Zubehör > Rollatoren;249.0000;3-4 Tage;https://www.brandvital.de/rollator-explorer.html;https://www.brandvital.de/pub/media/catalog/product/r/e/rehasense-rollator-explorer_1.jpg;https://www.brandvital.de/pub/media/catalog/product/r/e/rehasense-rollator-explorer-hinteransicht_1.jpg;;0;0;0;0;0;0;0;0;0;0;0;;<h2><span style="color: #000000 ">Explorer – der Outdoor Rollator</span></h2><br /><p><span style="color: #000000 ">Der Explorer wiegt 9 kg und ist mit seinem breiten Rahmen für max. 200 kg zugelassen. Er besitzt weiche große Räder und eignet sich durch seine Ausstattung perfekt für den Outdoor-Bereich.</span></p><br /><h2><span style="color: #000000 ">Komfort für unterwegs</span></h2><br /><p><span style="color: #000000 ">Der Explorer ist schnell und einfach zusammengeklappt und bleibt auch in geklappter Position, dank des einfachen Verschlusssystems, alleine stehen. In geklapptem Zustand, besitzt die Gehilfe einen ergonomisch gestalteten Tragegriff, um Ihnen einen höchstmöglichen Tragekomfort zu garantieren.</span></p><br /><h2><span style="color: #000000 ">Fest, sicher und beanspruchbar!</span></h2><br /><p><span style="color: #000000 ">Der Rahmen und der Sitz des Explorer Rollators wurden geprüft und für ein maximales Benutzergewicht von 200 kg zugelassen.</span></p><br /><p><span style="color: #000000 ">Die Bremsen des Rollators sind leicht zu betätigen und sehr sicher. Die weichen Räder sind mit einer doppelten PU-Schicht ausgestattet.</span></p><br /><h2><span style="color: #000000 ">Ausführungen des Rollator Explorer</span></h2><br /><p><span style="color: #000000 ">Den Explorer gibt es in 2 Größen: mittelgroß und groß </span></p><br /><h2><span style="color: #000000 ">Flexibel</span></h2><br /><p><span style="color: #000000 ">Die Schiebegriffe des Explorer Rollators sind höheverstellbar von 78 cm bis 112 cm. </span></p><br /><p><span style="color: #000000 ">Die Sitzhöhe lässt sich in 2 verschiedenen Höhen einstellen. Man hat die Wahl zwischen 53 und 62 cm mit einer breiten Sitzgrundlage von 53 cm.</span></p><br /><p><span style="color: #000000 ">Das neue Rahmendesign und die ergonomischen Schiebegriffe garantieren den Benutzerkomfort.</span><span style="color: #000000 "><br /></span></p><br /><h2><span style="color: #000000 ">Ergonomische Griffe</span></h2><br /><p><span style="color: #000000 ">Die neuen ergonomisch geformten Griffe dienen der korrekten Positionierung der Hände. </span></p>;;
RHS-ACR01012;;ACR01012;Rehasense;Rehasense Stockhalter ;Mobilität > Rollatoren und Zubehör > Rollatoren Zubehör;14.5000;3-4 Tage;https://www.brandvital.de/rehasense-stockhalter.html;https://www.brandvital.de/pub/media/catalog/product/r/e/rehasense-stockhalter.jpg;;;5.9500;5.9500;5.9500;5.9500;5.9500;5.9500;5.9500;5.9500;5.9500;5.9500;5.9500;;<p>Der Rehasense Stockhalter ist einfach zu montieren. Er wird an den Rahmen des Rollators befestigt. Der obere Teil des Stockhalters ist für ein Durchmesser von 16 - 19 mm und 20 - 29 mm geeignet. Der Gummifuß passt im unteren Teil des Rollators.</p><br /><p>Der Stockhalter ist für <strong>folgende </strong> Rehasense Rollatoren: </p><br /><ul><br /><li>Athlon</li><br /><li>Server HD</li><br /><li>Explorer</li><br /><li>Router Life</li><br /></ul>;;
